<?xml version="1.0" encoding="UTF-8"?>

<!DOCTYPE TaskDescription SYSTEM "fsautomat.dtd" >

<TaskDescription>
	<State id="INIT" type="systemInitialization">
		<taskInit>
			<ecp name="ROBOT_IRP6_ON_TRACK">
				<ecp_smooth_gen>1</ecp_smooth_gen>		
			</ecp>
			<ecp name="ROBOT_IRP6_POSTUMENT">
				<ecp_smooth_gen>1</ecp_smooth_gen>
			</ecp>
		</taskInit>
		<transition condition="true" target="approach_12"/>
	</State>	
	<State id="approach_12" type="runGenerator">
		<ROBOT>ROBOT_IRP6_ON_TRACK</ROBOT>
		<ECPGeneratorType>ECP_GEN_SMOOTH</ECPGeneratorType>
		<Trajectory coordinateType="JOINT" numOfPoses="1">
			<Pose>
				<StartVelocity>0	0	0	0	0	0	0	0</StartVelocity>
				<EndVelocity>0	0	0	0	0	0	0	0</EndVelocity>
				<Velocity>0.5	0.5	0.5	0.5	0.5	0.5	0.5	1</Velocity>
				<Accelerations>0.1	0.1	0.1	0.1	0.1	0.1	0.1	0.01</Accelerations>
				<Coordinates>0	-0.087462	-1.54187	0.024063	1.21873	2.57816	-2.66439	0.057</Coordinates>
			</Pose>
		</Trajectory>
		<transition condition="true" target="approach_13"/>
	</State>
	<State id="approach_13" type="runGenerator">
		<ROBOT>ROBOT_IRP6_POSTUMENT</ROBOT>
		<ECPGeneratorType>ECP_GEN_SMOOTH</ECPGeneratorType>
		<Trajectory coordinateType="JOINT" numOfPoses="1">
			<Pose>
				<StartVelocity>0	0	0	0	0	0	0	0</StartVelocity>
				<EndVelocity>0	0	0	0	0	0	0	0</EndVelocity>
				<Velocity>0.5	0.5	0.5	0.5	0.5	0.5	0.5	1</Velocity>
				<Accelerations>0.1	0.1	0.1	0.1	0.1	0.1	0.1	0.01</Accelerations>
				<Coordinates>-0.100633	-1.54194	0.048591	1.19773	2.10098	-2.7312	0.074	0</Coordinates>
			</Pose>
		</Trajectory>
		<transition condition="true" target="_END_"/>
	</State>
	
	<!-- ################################################################################################################################### -->

	<xi:include href="faceTurnOperations.xml" parse="xml" xmlns:xi='http://www.w3.org/2001/XInclude'/>
	<xi:include href="faceChangeOperations.xml" parse="xml" xmlns:xi='http://www.w3.org/2001/XInclude'/>
	<!-- ################################################################################################################################### -->
	<!--  -->
	<!--  -->
	
</TaskDescription>

