<?xml version="1.0" encoding="UTF-8"?>

<!DOCTYPE TaskDescription SYSTEM "fsautomat.dtd" >

<TaskDescription>
	<State id="INIT" type="systemInitialization">
		<taskInit>
			<ecp name="ROBOT_IRP6P_M">
				<ecp_smooth_gen>6</ecp_smooth_gen>
				<bias_edp_force_st></bias_edp_force_st>
			</ecp>
			<ecp name="ROBOT_IRP6OT_M">
				<ecp_smooth_gen>7</ecp_smooth_gen>
				<bias_edp_force_st></bias_edp_force_st>
			</ecp>
		</taskInit>
		<transition condition="true" target="approach_1"/>
	</State>
	<State id="approach_1" type="runGenerator">
		<ROBOT>ROBOT_IRP6P_M</ROBOT>
		<ECPGeneratorType>ECP_GEN_NEWSMOOTH</ECPGeneratorType>
		<TrajectoryFilePath>../../src/application/swarm_demo/trajectory_postument_joint.trj</TrajectoryFilePath>
		<Trajectory coordinateType="JOINT" numOfPoses="1">
			<Pose>
				<Velocity>0.1	0.1	0.1	0.1	0.1	0.1</Velocity>
				<Accelerations>0.07	0.07	0.07	0.07	0.07	0.07</Accelerations>
				<Coordinates>-1.576715 -1.910680 0.299621 0.039053 1.570008 -1.563285</Coordinates>
			</Pose>
		</Trajectory>
		<transition condition="true" target="approach_2"/>
	</State>
	<State id="approach_2" type="runGenerator">
		<ROBOT>ROBOT_IRP6OT_M</ROBOT>
		<ECPGeneratorType>ECP_GEN_NEWSMOOTH</ECPGeneratorType>
		<TrajectoryFilePath>../../src/application/swarm_demo/trajectory_track_joint.trj</TrajectoryFilePath>
		<Trajectory coordinateType="JOINT" numOfPoses="1">
			<Pose>
				<Velocity>0.05	0.2	0.2	0.2	0.2	0.2	0.2</Velocity>
				<Accelerations>0.04	0.08	0.08	0.08	0.08	0.08	0.08</Accelerations>
				<Coordinates>0.20000 1.570545 -1.760752 0.202086 0.011934 1.570013 1.570545</Coordinates>
			</Pose>
		</Trajectory>
		<transition condition="true" target="approach_3"/>
	</State>
	<State id="approach_3" type="emptyGenForSet">
		<SetOfRobots>
			<FirstSet>
				<ROBOT>ROBOT_IRP6P_M</ROBOT>
				<ROBOT>ROBOT_IRP6OT_M</ROBOT>
			</FirstSet>			
			<SecSet>
				<ROBOT>ROBOT_IRP6P_M</ROBOT>
				<ROBOT>ROBOT_IRP6OT_M</ROBOT>		
			</SecSet>
		</SetOfRobots>
		<transition condition="true" target="bias_post"/>
	</State>
	<State id="bias_post" type="runGenerator">
		<ROBOT>ROBOT_IRP6P_M</ROBOT>
		<ECPGeneratorType>ECP_ST_BIAS_EDP_FORCE</ECPGeneratorType>
		<AddArg>5</AddArg>
		<transition condition="true" target="bias_track"/>
	</State>
	<State id="bias_track" type="runGenerator">
		<ROBOT>ROBOT_IRP6OT_M</ROBOT>
		<ECPGeneratorType>ECP_ST_BIAS_EDP_FORCE</ECPGeneratorType>
		<AddArg>5</AddArg>
		<transition condition="true" target="wait2"/>
	</State>
	<State id="wait2" type="emptyGenForSet">
		<SetOfRobots>
			<FirstSet>
				<ROBOT>ROBOT_IRP6P_M</ROBOT>
				<ROBOT>ROBOT_IRP6OT_M</ROBOT>
			</FirstSet>			
			<SecSet>
				<ROBOT>ROBOT_IRP6P_M</ROBOT>
				<ROBOT>ROBOT_IRP6OT_M</ROBOT>		
			</SecSet>
		</SetOfRobots>
		<transition condition="true" target="approach_4"/>
	</State>
	<State id="approach_4" type="wait">
		<TimeSpan>1000</TimeSpan>
		<transition condition="true" target="approach_5"/>
	</State>
	<State id="approach_5" type="runGenerator">
		<ROBOT>ROBOT_IRP6P_M</ROBOT>
		<ECPGeneratorType>ECP_GEN_NEWSMOOTH</ECPGeneratorType>
		<TrajectoryFilePath>../../src/application/swarm_demo/trajectory_postument_angle_p1.trj</TrajectoryFilePath>
		<Trajectory coordinateType="ecp_XYZ_ANGLE_AXIS" numOfPoses="1">
			<Pose>
				<Velocity>0.1	0.1	0.1	0.1	0.1	0.1</Velocity>
				<Accelerations>0.07	0.07	0.07	0.07	0.07	0.07</Accelerations>
				<Coordinates> -0.509557 1.268231 0.676142  0 0 1.57</Coordinates>
			</Pose>
		</Trajectory>
		<transition condition="true" target="approach_6"/>
	</State>
	<State id="approach_6" type="emptyGen">
		<ROBOT>ROBOT_IRP6OT_M</ROBOT>	
		<AddArg>1</AddArg>
		<transition condition="true" target="post_grip_1"/>
	</State>
	<State id="post_grip_1" type="runGenerator">
		<ROBOT>ROBOT_IRP6P_M</ROBOT>
		<ECPGeneratorType>ECP_GEN_TFF_GRIPPER_APPROACH</ECPGeneratorType>
		<AddArg>0</AddArg>
		<transition condition="true" target="wait_post"/>
	</State>
	<State id="wait_post" type="emptyGen">
		<ROBOT>ROBOT_IRP6OT_M</ROBOT>	
		<AddArg>1</AddArg>
		<transition condition="true" target="wait_"/>
	</State>
	<State id="wait_" type="wait">
		<TimeSpan>1000</TimeSpan>
		<transition condition="true" target="_STOP_"/>
	</State>
	
	<!-- ################################################################################################################################### -->

	<!-- <xi:include href="faceTurnOperations.xml" parse="xml" xmlns:xi='http://www.w3.org/2001/XInclude'/> -->
	<!-- <xi:include href="faceChangeOperations.xml" parse="xml" xmlns:xi='http://www.w3.org/2001/XInclude'/> -->
	<!-- ################################################################################################################################### -->
	<!--  -->
	<!--  -->
	
</TaskDescription>

